CODE;ENGLISH;FRENCH;GERMAN;POLISH;SPANISH;HUNGARIAN;CZECH;HUNGARIAN;DUTCH;PORTUGUESE;RUSSIAN;FINNISH;;x;;;;;;;;;;;;;;;;
embargo_nation_desc;금수조치는 특정국(들)과의 무역을 부분적/전체적으로 금지하는 행위입니다. 금수조치는 해당 국가에게서 국익적인 결과를 이끌어내는데 강력한 외교적 조치입니다. 금수조치는 경제제재와 유사하지만, 일반적으로 전시에 쓰이는 봉쇄와는 다르게 무역장벽에 해당합니다. 금수 조치의 종류에는 수출입 제한/금지/할당제, 특별관세 부과, 세금 부과, 화물/운송 차량 금지, 화물/자산/은행 계좌 동결 및 압류, 특정 기술/제품 운송 제한 등이 있습니다. 강력한 금수조치를 받은 지역은 금수조치에 대응해 경제자립정책을 자주 시행합니다. 따라서 금수조치의 실효성은 해당 국가의 국제참여 범위 및 정도에 비례합니다.;An embargo is the partial or complete prohibition of commerce and trade with a particular country or a group of countries. Embargoes are considered strong diplomatic measures imposed in an effort, by the imposing country, to elicit a given national-interest result from the country on which it is imposed. Embargoes are similar to economic sanctions and are generally considered legal barriers to trade, not to be confused with blockades, which are often considered to be acts of war. Embargoes can mean limiting or banning export or import, creating quotas for quantity, imposing special tolls, taxes, banning freight or transport vehicles, freezing or seizing freights, assets, bank accounts, limiting the transport of particular technologies or products (high-tech) for example CoCom during the cold-war. In response to embargoes, an independent economy or autarky often develops in an area subjected to heavy embargo. Effectiveness of embargoes is thus in proportion to the extent and degree of international participation.;;;;;;;;x
embargo_nation;외국의 금수조치;Being Embargoed by Foreign Powers;;;;;;;;x
total_embargo_nation;총금수조치;Facing a Total Embargo;;;;;;;;x
embargoing_nation;인접국 금수조치;Embargoing a Neighbouring Nation;;;;;;;;x
economic_malaise;경제적 문제;Economic Malaise;;;;;;;;x
EVTDESC1400069;국유화는 사유재산을 정부나 국가의 소유로 전환하는 과정으로, 보통 자치단체 등 정부 하위기관 소유의 자산을 국가에 이전하는 행위를 말합니다. 국유화의 반대는 민영화, 지방자치화, 그리고 분권화입니다. 종전에 국유화했던 자산을 민영화한 후 정부가 다시 국유화하는 경우, 그들은 신화를 겪었다고 합니다. 일반적으로 국유화 대상 산업은 운송, 통신, 에너지, 은행 및 천연 자원을 포함합니다. 국유화는 이전 소유주에 대한 보상 여부와는 관계없으며, 정부가 국유화된 부동산을 통제한다는 점에서 재산 재분배와 차별화됩니다.;Nationalisation, is the process of transforming private assets into public assets by bringing them under the public ownership of a national government or state. Nationalisation usually refers to private assets or assets owned by lower levels of government, such as municipalities, being transferred to the state. The opposites of nationalisation are privatisation, municipalisation and demutualisation. When previously nationalised assets are privatised and subsequently returned to public ownership by a later government, they are said to have undergone renationalisation. Industries that are usually subject to nationalisation include transport, communications, energy, banking and natural resources. Nationalisation may occur with or without compensation to the former owners. Nationalisation is distinguished from property redistribution in that the government retains control of nationalised property.;;;;;;;;x
attempt_nationalisation_title;주요 산업 국유화;Nationalise Major Industries;;;;;;;;x
attempt_nationalisation_desc;국유화는 사유재산을 정부나 국가의 소유로 전환하는 과정으로, 보통 자치단체 등 정부 하위기관 소유의 자산을 국가에 이전하는 행위를 말합니다. 국유화의 반대는 민영화, 지방자치화, 그리고 분권화입니다. 종전에 국유화했던 자산을 민영화한 후 정부가 다시 국유화하는 경우, 그들은 신화를 겪었다고 합니다. 일반적으로 국유화 대상 산업은 운송, 통신, 에너지, 은행 및 천연 자원을 포함합니다. 국유화는 이전 소유주에 대한 보상 여부와는 관계없으며, 정부가 국유화된 부동산을 통제한다는 점에서 재산 재분배와 차별화됩니다.;Nationalisation, is the process of transforming private assets into public assets by bringing them under the public ownership of a national government or state. Nationalisation usually refers to private assets or assets owned by lower levels of government, such as municipalities, being transferred to the state. The opposites of nationalisation are privatisation, municipalisation and demutualisation. When previously nationalised assets are privatised and subsequently returned to public ownership by a later government, they are said to have undergone renationalisation. Industries that are usually subject to nationalisation include transport, communications, energy, banking and natural resources. Nationalisation may occur with or without compensation to the former owners. Nationalisation is distinguished from property redistribution in that the government retains control of nationalised property.;;;;;;;;x
attempt_privatisation_title;주요 국영산업 민영화;Privatise Major Nationalised Industries;;;;;;;;x
attempt_privatisation_desc;공공부문은 정부기관이 운영하는 경제체제의 일부입니다. 민영화는 정부가 소유한 자산을 매각하거나 민간 기업이 특정 산업에 종사하지 못하게 제한하는 규제를 철폐하는 행위로, 많은 선진국과 개발도상국이 진행하고 있는 추세입니다. 민영화 지지자들은 민간부문의 경쟁이 효율을 올려 더나은 서비스와 제품, 더 낮은 가격, 그리고 부패를 줄인다고 주장합니다. 반면에, 민영화 비판자들은 통제를 유지하고 접근성을 공평하게 유지하려면 의료, 공공사업, 교육 그리고 법 집행과 같은 일부 서비스들은 공공 부문에 있어야만 한다고 주장합니다.;The public sector is the part of the economic system that is run by government agencies. Privatisation may involve either sale of government-held assets or removal of restrictions preventing private individuals and businesses from participating in a given industry. Privatisation is an ongoing trend in many parts of the developed and developing world. Proponents of privatisation maintain that the competition in the private sector fosters more efficient practices, which eventually yield better service and products, lower prices and less corruption. On the other hand, critics of privatisation argue that some services - such as health care, utilities, education and law enforcement - should be in the public sector to enable greater control and ensure more equitable access.;;;;;;;;x
nationalisation_of_industry;주요 산업 국유화;Major Industries Nationalised;;;;;;;;x
nationalisation_in_progress;최근 주요 산업 국유화;Major Industries Nationalised Recently;;;;;;;;x
privatisation_in_progress;최근 주요 산업 민영화;Major Industries Privatised Recently;;;;;;;;x
privatisation_of_industry;주요 산업 민영화;Major Industries Privatised;;;;;;;;x
EVTDESC64570;전략무기제한협정은 미국과 소련이 참여한 냉전시대 초강대국들의 무기제한 문제에 관한 두 차례의 협정으로, 제1차와 제2차 두차례에 걸쳐 이뤄졌습니다. 1969년 11월 핀란드 헬싱키에서 시작한 제1차 협정은 탄도탄 요격미사일에 대한 조약과 양국간의 중간협정을 이끌었습니다. 1979년에는 제2차 협정을 체결했지만, 미국 상원은 그 해 말에 일어난 아프가니스탄-소련 전쟁을 이유로 비준하지 않았으며, 소련 입법부 역시 비준하지 않았습니다. 해당 협정은 1985년 12월 31일에 만료했으며 양국은 이를 갱신하지 않았습니다. 2011년 2월, 양국은 신전략무기제한회담을 최종적으로 비준했습니다.;The Strategic Arms Limitation Talks (SALT) were two rounds of bilateral conferences and corresponding international treaties involving the United States and the Soviet Union뾲he Cold War superpowers뾬n the issue of armament control. The two rounds of talks and agreements were SALT I and SALT II. Negotiations commenced in Helsinki, Finland, in November 1969. SALT I led to the Anti-Ballistic Missile Treaty and an interim agreement between the two countries. Although SALT II resulted in an agreement in 1979, the United States Senate chose not to ratify the treaty in response to the Soviet war in Afghanistan, which took place later that year. The Soviet legislature also did not ratify it. The agreement expired on December 31, 1985 and was not renewed. The treaties led to the STARTs, or Strategic Arms Reduction Treaties, which consisted of START I and START II, both of which proposed limits on multiple-warhead capacities and other restrictions on each side's number of nuclear weapons. A successor to START I, New START, was proposed and was eventually ratified in February 2011.;;;;;;;;x
EVTDESC64571;중거리핵전력조약은 1987년 미국과 소련이 체결한 중거리/단거리 미사일 해제에 관한 조약의 약칭입니다. 1987년 12월 8일 로널드 레이건 대통령과 소련 지도자 미하일 고르바초프이 워싱턴 D.C.에서 조인한 헤당 조약은 1988년 5월 27일 미국 상원의 비준을 받은 뒤 1988년 6월 1일부터 발효됐습니다. 해당 조약은 모든 핵 및 재래식 미사일과 그 발사대를 제한했는데, 그 범위는 500,000km(단거리) 1,000,500km(중거리)입니다. 한편 해당 조약은 해상 미사일에 대해서는 다루지 않았습니다. 1991년 5월까지 2천692기의 미사일을 제거했으며 10년간 현장 검증 점검을 이어갔습니다.;The Intermediate-Range Nuclear Forces Treaty (INF Treaty) is the abbreviated name of the Treaty Between the United States of America and the Union of Soviet Socialist Republics on the Elimination of Their Intermediate-Range and Shorter-Range Missiles, a 1987 agreement between the United States and the Soviet Union (and later its successor states, in particular the Russian Federation). Signed in Washington, D.C. by President Ronald Reagan and Soviet leader Mikhail Gorbachev on 8 December 1987, the treaty was ratified by the United States Senate on 27 May 1988 and came into force on 1 June 1988. The INF Treaty eliminated all nuclear and conventional missiles, as well as their launchers, with ranges of 500?,000 kilometres (310?20 mi) (short-range) and 1,000?,500 kilometres (620?,420 mi) (intermediate-range). The treaty did not cover sea-launched missiles. By May 1991, 2,692 missiles were eliminated, followed by 10 years of on-site verification inspections.;;;;;;;;x
EVTDESC64572;전략무기제한회담은 전략무기의 감축과 제한에 관한 미합중국 및 소비에트 사회주의 공화국 연합이 체결한 조약입니다. 1991년 7월 31일 체결됐고 1994년 12월 5일부터 발효됐습니다. 해당 협정은 서명국들의 대륙간탄도미사일 및 핵탄두 보유대수를 각각 1,600개, 6,000개까지로 제한했습니다. 협정을 최종적으로 시행한 2001년 말에는 당시 존재했던 전략핵무기의 약 80%를 제거하는데 성공했습니다. 해당 협정은 제2차 조약 협상을 시작한 후 제1차 협정으로 개명됐습니다.;START (Strategic Arms Reduction Treaty) was a bilateral treaty between the United States of America and the Union of Soviet Socialist Republics (USSR) on the reduction and limitation of strategic offensive arms. The treaty was signed on 31 July 1991 and entered into force on 5 December 1994. The treaty barred its signatories from deploying more than 6,000 nuclear warheads atop a total of 1,600 inter-continental ballistic missiles (ICBMs) and bombers. START negotiated the largest and most complex arms control treaty in history, and its final implementation in late 2001 resulted in the removal of about 80 percent of all strategic nuclear weapons then in existence. Proposed by United States President Ronald Reagan, it was renamed START I after negotiations began on the second START treaty.;;;;;;;;x
EVTDESC64573;탄도탄요격미사일조약은 탄도탄수송핵무기를 방어하는 데 쓰이는 탄도탄수격미사일체계를 제한하는 미국과 소련의 조약으로, 1972년에 서명한 후 30년 동안 양국의 탄도탄 요격미사일을 각각 2개 단지와 100기로 제한했습니다. 소비에트 연방이 해체된 후 1997년 4개의 구소련 공화국이 해당 조약에서 소련의 역할을 계승하기로 미국과 합의했습니다. 2002년 6월 미국은 조약을 탈퇴했고, 조약은 해지됐습니다.;The Anti-Ballistic Missile Treaty (ABM Treaty or ABMT) was a treaty between the United States and the Soviet Union on the limitation of the anti-ballistic missile (ABM) systems used in defending areas against ballistic missile-delivered nuclear weapons. Under the terms of the treaty, each party was limited to two ABM complexes, each of which was to be limited to 100 anti-ballistic missiles. Signed in 1972, it was in force for the next 30 years. Following the dissolution of the Soviet Union, in 1997 four former Soviet republics agreed with the United States to succeed the USSR's role in the treaty. In June 2002 the United States withdrew from the treaty, leading to its termination.;;;;;;;;x
salt_treaty;전략무기제한협정 조인국;Signatory to the SALT Treaties;;;;;;;;x
abm_treaty;탄도탄요격미사일조약 조인국;Signatory to the ABM Treaties;;;;;;;;x
start_treaty;전략무기제한회담 조인국;Signatory to the START Treaties;;;;;;;;x
inf_treaty;중거리핵전력조약 조인국;Signatory to the INF Treaties;;;;;;;;x
sdi_development;전략방위계획 수립 중;Developing the Strategic Defence Initiative;;;;;;;;x
sdi_completed;핵방어능력 보유국;Possess Anti-Nuclear Attack Capability;;;;;;;;x
develop_sdi_title;전략방위계획 수립;Begin development of the Strategic Defense Initiative;;;;;;;;x
develop_sdi_desc;전략방위계획은 탄도미사일 전략핵무기(대륙간탄도미사일, 잠수함발사탄도미사일)의 공격을 막기 위한 미사일 방어체계입니다. 지상부대와 궤도배치대를 결합한 해당 체제는 1983년 3월 23일 로널드 레이건 대통령이 처음으로 공개했습니다. 이번 계힉은 기존의 상호확증파괴 전략공격론보다는 전략적 방어에 초점을 맞췄습니다.;The Strategic Defense Initiative (SDI) was a proposed missile defense system intended to protect the United States from attack by ballistic strategic nuclear weapons (intercontinental ballistic missiles and submarine-launched ballistic missiles). The system, which was to combine ground-based units and orbital deployment platforms, was first publicly announced by President Ronald Reagan on March 23, 1983. The initiative focused on strategic defense rather than the prior strategic offense doctrine of mutual assured destruction (MAD). We shall create something similar.;;;;;;;;x
salt_treaty_title;전략무기제한협정 제안;Propose SALT treaties;;;;;;;;x
salt_treaty_desc;전략무기제한협정은 냉전시대 강대국 미국과 소련이 군비제한 문제를 논의한 두차례에 걸친 조약입니다. 이번엔 우리가 비슷한 것을 제안해보겠습니다.;The Strategic Arms Limitation Talks (SALT) were two rounds of bilateral conferences and corresponding international treaties involving the United States and the Soviet Union뾲he Cold War superpowers뾬n the issue of armament control. The two rounds of talks and agreements were SALT I and SALT II. We shall propse soemthing similar.;;;;;;;;x
inf_treaty_title;중거리핵전력조약 제안;Propose a INF treaty;;;;;;;;x
inf_treaty_desc;중거리핵전력조약은 1987년 미국과 소련이 체결한 중거리/단거리 미사일 해제에 관한 조약의 약칭입니다. 1987년 12월 8일 로널드 레이건 대통령과 소련 지도자 미하일 고르바초프이 워싱턴 D.C.에서 조인한 헤당 조약은 1988년 5월 27일 미국 상원의 비준을 받은 뒤 1988년 6월 1일부터 발효됐습니다. 이번엔 우리가 비슷한 것을 제안해보겠습니다.;The Intermediate-Range Nuclear Forces Treaty (INF Treaty) is the abbreviated name of the Treaty Between the United States of America and the Union of Soviet Socialist Republics on the Elimination of Their Intermediate-Range and Shorter-Range Missiles, a 1987 agreement between the United States and the Soviet Union (and later its successor states, in particular the Russian Federation). Signed in Washington, D.C. by President Ronald Reagan and Soviet leader Mikhail Gorbachev on 8 December 1987, the treaty was ratified by the United States Senate on 27 May 1988 and came into force on 1 June 1988. We shall propose something similar.;;;;;;;;x
start_treaty_title;전략무기제한회담 제안;Propose START treaties;;;;;;;;x
start_treaty_desc;전략무기제한회담은 전략무기의 감축과 제한에 관한 미합중국 및 소비에트 사회주의 공화국 연합이 체결한 조약입니다. 1991년 7월 31일 체결됐고 1994년 12월 5일부터 발효됐습니다. 해당 협정은 서명국들의 대륙간탄도미사일 및 핵탄두 보유대수를 각각 1,600개, 6,000개까지로 제한했습니다. 협정을 최종적으로 시행한 2001년 말에는 당시 존재했던 전략핵무기의 약 80%를 제거하는데 성공했습니다. 해당 협정은 제2차 조약 협상을 시작한 후 제1차 협장으로 개명됐습니다.;START (Strategic Arms Reduction Treaty) was a bilateral treaty between the United States of America and the Union of Soviet Socialist Republics (USSR) on the reduction and limitation of strategic offensive arms. The treaty was signed on 31 July 1991 and entered into force on 5 December 1994. The treaty barred its signatories from deploying more than 6,000 nuclear warheads atop a total of 1,600 inter-continental ballistic missiles (ICBMs) and bombers. START negotiated the largest and most complex arms control treaty in history, and its final implementation in late 2001 resulted in the removal of about 80 percent of all strategic nuclear weapons then in existence. Proposed by United States President Ronald Reagan, it was renamed START I after negotiations began on the second START treaty.;;;;;;;;x
abm_treaty_title;탄도탄요격미사일조약 제안;Propose an ABM treaty;;;;;;;;x
abm_treaty_desc;탄도탄요격미사일조약은 탄도탄수송핵무기를 방어하는데 쓰이는 탄도탄요격미사일체계를 제한하는 미국과 소련의 조약으로, 1972년에 서명한 후 30년 동안 양국의 탄도탄 요격미사일을 각각 2개 단지와 100기로 제한했습니다.;The Anti-Ballistic Missile Treaty (ABM Treaty or ABMT) was a treaty between the United States and the Soviet Union on the limitation of the anti-ballistic missile (ABM) systems used in defending areas against ballistic missile-delivered nuclear weapons. Under the terms of the treaty, each party was limited to two ABM complexes, each of which was to be limited to 100 anti-ballistic missiles.;;;;;;;;x
build_sdi_title;전략방위계획 수립;Begin the Strategic Defence Initiative;;;;;;;;x
build_sdi_desc;전략방위계획은 탄도미사일 전략핵무기(대륙간탄도미사일, 잠수함발사탄도미사일)의 공격을 막기 위한 미사일 방어체계입니다. 지상부대와 궤도배치대를 결합한 해당 체제는 1983년 3월 23일 로널드 레이건 대통령이 처음으로 공개했습니다. 이번 계힉은 기존의 상호확증파괴 전략공격론보다는 전략적 방어에 초점을 맞췄습니다. 우리도 비슷한 체계를 수립해야 합니다.;The Strategic Defense Initiative (SDI) was a proposed missile defense system intended to protect the United States from attack by ballistic strategic nuclear weapons (intercontinental ballistic missiles and submarine-launched ballistic missiles). The system, which was to combine ground-based units and orbital deployment platforms, was first publicly announced by President Ronald Reagan on March 23, 1983. The initiative focused on strategic defense rather than the prior strategic offense doctrine of mutual assured destruction (MAD). We shall create something similar.;;;;;;;;x
cdhigh;강한 민방위정책;Strong Civil Defence policy;;;;;;;;x
cdmedium;용인할만큼 강한 민방위정책;Acceptably strong Civil Defence policy;;;;;;;;x
cdlow;약한 민방위정책;Weak Civil Defense policy;;;;;;;;x
changecd_title;민방위정책 변경;Change Civil Defence policy;;;;;;;;x
changecd_desc;평시와 달리 정말 강력한 민방위정책이 필요하므로 필요에 더 잘 맞도록 정책을 변경합니다. 민방위란 국가의 시민(일반적으로 비전투원)을 군사적 공격이나 자연재해에게서 보호하려는 노력의 일부입니다. 비상 운영, 예방, 완화, 준비, 대응 또는 비상 대피 및 복구 등을 포함합니다.;Change Civil Defence policy to better suit our needs because do we really need to have such a strong defence policy while we at peace? Civil defence or civil protection is an effort to protect the citizens of a state (generally non-combatants) from military attacks and natural disasters. It uses the principles of emergency operations, prevention, mitigation, preparation, response, or emergency evacuation and recovery.;;;;;;;;x
cdhigh_title;강한 민방위정책 설정;Set strong Civil Defence policy;;;;;;;;x
cdmedium_title;용인할만큼 강한 민방위정책 설정;Set acceptably strong Civil Defence policy;;;;;;;;x
cdlow_title;약한 민방위정책 설정;Set weak Civil Defense policy;;;;;;;;x
cdhigh_desc;민방위란 국가의 시민(일반적으로 비전투원)을 군사적 공격이나 자연재해에게서 보호하려는 노력의 일부입니다. 비상 운영, 예방, 완화, 준비, 대응 또는 비상 대피 및 복구 등을 포함합니다. 이러한 민방위정책들은 적어도 1920년부터 논의됐으며, 1930년대에 전쟁 및 공중폭격의 위협이 증가하자 몇몇 국가들이 시행하기 시작했습니다. 이후 핵위협이 실현되면서 더 널리 퍼졌습니다.;Civil defence or civil protection is an effort to protect the citizens of a state (generally non-combatants) from military attacks and natural disasters. It uses the principles of emergency operations: prevention, mitigation, preparation, response, or emergency evacuation and recovery. Programs of this sort were initially discussed at least as early as the 1920s and were implemented in some countries during the 1930s as the threat of war and aerial bombardment grew. It became widespread after the threat of nuclear weapons was realised.;;;;;;;;x
cdmedium_desc;민방위란 국가의 시민(일반적으로 비전투원)을 군사적 공격이나 자연재해에게서 보호하려는 노력의 일부입니다. 비상 운영, 예방, 완화, 준비, 대응 또는 비상 대피 및 복구 등을 포함합니다. 이러한 민방위정책들은 적어도 1920년부터 논의됐으며, 1930년대에 전쟁 및 공중폭격의 위협이 증가하자 몇몇 국가들이 시행하기 시작했습니다. 이후 핵위협이 실현되면서 더 널리 퍼졌습니다.;Civil defence or civil protection is an effort to protect the citizens of a state (generally non-combatants) from military attacks and natural disasters. It uses the principles of emergency operations: prevention, mitigation, preparation, response, or emergency evacuation and recovery. Programs of this sort were initially discussed at least as early as the 1920s and were implemented in some countries during the 1930s as the threat of war and aerial bombardment grew. It became widespread after the threat of nuclear weapons was realised.;;;;;;;;x
cdlow_desc;민방위란 국가의 시민(일반적으로 비전투원)을 군사적 공격이나 자연재해에게서 보호하려는 노력의 일부입니다. 비상 운영, 예방, 완화, 준비, 대응 또는 비상 대피 및 복구 등을 포함합니다. 이러한 민방위정책들은 적어도 1920년부터 논의됐으며, 1930년대에 전쟁 및 공중폭격의 위협이 증가하자 몇몇 국가들이 시행하기 시작했습니다. 이후 핵위협이 실현되면서 더 널리 퍼졌습니다.;Civil defence or civil protection is an effort to protect the citizens of a state (generally non-combatants) from military attacks and natural disasters. It uses the principles of emergency operations: prevention, mitigation, preparation, response, or emergency evacuation and recovery. Programs of this sort were initially discussed at least as early as the 1920s and were implemented in some countries during the 1930s as the threat of war and aerial bombardment grew. It became widespread after the threat of nuclear weapons was realised.;;;;;;;;x
changenato_title;북대서양 조약기구의 방위비정책 변경;Change NATO policy on member's burdens to the Organisation;;;;;;;;x
