CODE;ENGLISH;FRENCH;GERMAN;POLISH;SPANISH;HUNGARIAN;CZECH;HUNGARIAN;DUTCH;PORTUGUESE;RUSSIAN;FINNISH;;x;;;;;;;;;;;;;;;;
claim_12_desc;기준선으로부터 12해리에 이르는 해안 주는 법을 제정하고 사용을 규제하며 모든 자원을 자유롭게 사용할 수 있습니다. 배는 영해 안에서서는 무한하게 통행할 수 있으며, 해상 선박이 영해를 침범하면 불법이라는 점을 이용해 군사용 선박의 통과를 허용하는 전략적 해협을 마련했습니다. "무고한 통행"은 협약에 의해 연안 주의 평화, 질서 또는 안전에 불리하지 않은 신속하고 지속적인 방식으로 영해를 통과하는 것입니다. 낚시, 오염, 무기 실습 및 감시는 "무죄"가 아니며 잠수함 및 기타 수중 차량은 표면을 항해하고 깃발을 보여주어야 합니다. 국가는 국가 보안의 보호를 위해 필수적일 경우 영해의 특정 지역에서 무고한 통과를 일시적으로 중단할 수 있습니다.;Out to 12 nautical miles from the baseline, the coastal state is free to set laws, regulate use, and use any resource. Vessels were given the right of innocent passage through any territorial waters, with strategic straits allowing the passage of military craft as transit passage, in that naval vessels are allowed to maintain postures that would be illegal in territorial waters. "Innocent passage" is defined by the convention as passing through waters in an expeditious and continuous manner, which is not "prejudicial to the peace, good order or the security" of the coastal state. Fishing, polluting, weapons practice, and spying are not "innocent", and submarines and other underwater vehicles are required to navigate on the surface and to show their flag. Nations can also temporarily suspend innocent passage in specific areas of their territorial seas, if doing so is essential for the protection of its security.;;;;;;;;x
claim_24_title;접속 수역 12해리 주장;Claim Contiguous zone of up 12 Nautical Miles;;;;;;;;x
claim_24_desc;영해 기준선 한계인 12해리(22 km) 너머에 12해리(22 km)가 또 있습니다. 접속 수역은 영토 또는 영해가 침해받거나 침해받으려 하는 경우 세관, 세무, 이민, 오염 영역에서 법을 집행할 수 있는 구역입니다.;Beyond the 12-nautical-mile (22 km) limit, there is a further 12 nautical miles (22 km) from the territorial sea baseline limit, the contiguous zone, in which a state can continue to enforce laws in four specific areas: customs, taxation, immigration and pollution, if the infringement started within the state's territory or territorial waters, or if this infringement is about to occur within the state's territory or territorial waters. This makes the contiguous zone a hot pursuit area.;;;;;;;;x
claim_200_title;배타적 경제수역 200해리 주장;Claim Exclusive Economic Zone of up 200 Nautical Miles from baseline;;;;;;;;x
claim_200_desc;배타적 경제수역은 영해 가장자리를 기준으로 200해리까지를 말합니다. 이 구역 내에서 연안국은 모든 천연자원에 대한 배타적인 채굴권을 갖습니다. 평상시에 해당 용어는 영해와 대륙붕까지 포함합니다. 배타적 경제수역을 도입한 이유는 점점 더 중요해지는 석유의 중요성에 더해, 점점 더 뜨거워지는 어업권을 둘러싼 충돌을 막기 위함입니다. 1947년 멕시코만에서 해양시추 성공은 곧 세계 다른 곳으로 퍼져났고, 1970년까지 4,000미터 깊이의 바다에서도 시추가 기술적으로 가능해졌습니다. 외국에게는 항해와 비행의 자유가 있으며, 연안국가의 규제에 따릅니다. 외국에서 해저 파이프와 케이블을 설치할 수도 있습니다.;These extend from the edge of the territorial sea out to 200 nautical miles from the baseline. Within this area, the coastal nation has sole exploitation rights over all natural resources. In casual use, the term may include the territorial sea and even the continental shelf. The EEZs were introduced to halt the increasingly heated clashes over fishing rights, although oil was also becoming important. The success of an offshore oil platform in the Gulf of Mexico in 1947 was soon repeated elsewhere in the world, and by 1970 it was technically feasible to operate in waters 4,000 metres deep. Foreign nations have the freedom of navigation and overflight, subject to the regulation of the coastal states. Foreign states may also lay submarine pipes and cables.;;;;;;;;x
join_isa_title;국제해저기구 가입;Join the International Seabed Authority;;;;;;;;x
join_isa_desc;국제해저기구는 자메이카 킹스턴에 위치한 정부간 기관으로, 세계 해양 대부분의 기초가 되는 지역인 국가 관할을 넘어 국제 해저지역의 모든 광물 관련 활동을 조직, 규제 및 통제하는 조직입니다.;The International Seabed Authority (ISA) is an intergovernmental body based in Kingston, Jamaica, that was established to organise, regulate and control all mineral-related activities in the international seabed area beyond the limits of national jurisdiction, an area underlying most of the world뭩 oceans. It is an organisation established by the Law of the Sea Convention.;;;;;;;;x
dispute_sea_title;인접국과의 영해 갈등;Dispute the Territorial Sea borders of a Neighbouring Nation;;;;;;;;x
dispute_sea_desc;인접국과 사이가 좋지 않으므로 영해 분쟁을 일으켜 그들을 모욕할 수 있습니다. 분쟁의 진전은 국제사법재판소에 중재 신청을 하는 것을 포함하며, 재판소는 향후 5년간 사건을 검토한 후 판단을 내릴 것입니다.;As we are on unfriendly terms with a neighbouring nation, we can decide to dispute their Territorial Sea Borders to humiliate them. The proccess of disputing involves bringing the case to the International Court of Justice (ICJ) to get arbitration and the ICJ will take the next 5 years reviewing our case before it will make a judgement on whether to accept our case or not.;;;;;;;;x
g8_chairmanship;주요 8개국 회의 주최국;Holder of the G8 Presidency;;;;;;;;x
g8high;G8 경제성장 중점;G8 Focuses on Economic Growth;;;;;;;;x
g8medium;G8 조화와 안정 중점;G8 Focuses on Harmony and Stability;;;;;;;;x
g8low;G8 기후변화 저감 중점;G8 Focuses on Climate Change Mitigation;;;;;;;;x
g8high_title;G8 경제성장 중점 변경;Change the Focus of the G8 to Economic Growth;;;;;;;;x
g8high_desc;경제성장을 촉진하면 지구의 자원에 무리를 주는 대가로 세계 경제의 성장을 가속화합니다.;Promoting economic growth can help the economies of the world to grow faster though it may come at the cost of straining the resources of the earth.;;;;;;;;x
g8medium_title;G8 조화와 안정 중점 변경;Change the Focus of the G8 to Harmony and Stability;;;;;;;;x
g8medium_desc;조화와 안정을 증진하면 세계사회가 평화와 상호이익을 위한 공존의 메시지가 서로에게 더 큰 포용력을 불어넣어 동화가 더 잘 이루어집니다.;Promoting Harmony and Stability can help the societies of the world to acheive better assimilation as the messages of peace and mutually beneficial coexistence breed greater tolerance for each other..;;;;;;;;x
g8low_title;G8 기후변화 저감 중점 변경;Change the Focus of the G8 to mitigating Climate Change;;;;;;;;x
g8low_desc;녹색 실천, 기술 및 사고의 사용을 전세계에 홍보하는 것은 경제활동의 환경에 대한 자원 부담을 줄이는데 도움이 됩니다.;Promoting the use of Green practices, technologies and thinking to the rest of the world can help to reduce the resource burden of our economic activities on the environment..;;;;;;;;x
changeg8_title;G8 중점 변경;Change the Focus of the Group of 8 Industrialised Countries;;;;;;;;x
changeg8_desc;주요 8개국을 가리키는 G8은 매년 모여 세계적 쟁점을 논의합니다. 매년 G8은 정상회담을 개최하는데, 회원국 정상과 정부가 만나 세계적 쟁점을 논의하고 조율하는 회의입니다. G8은 연례 정상회담으로 가장 잘 알려져 있지만, 사실 일년 내내 경제나 기후변화와 같은 중요한 현대적 주제를 다룹니다다. G8에서는 세계 정책을 논의하고 생성하지만, 이러한 정책들을 고수하는 것은 의무적이지 않으며 다른 국가들에게는 복종할지 말지를 결정할 자유가 있습니다.;The G8, otherwise known as the Group of Eight, is an assembly of world leaders who meet annually to discuss global issues.  Each year, the G8 holds a Leaders?Summit, in which Heads of State and Government of member countries meet to discuss and attempt to reconcile global issues.  Although the G8 is best known for its annual summits, it works throughout the year to tackle important contemporary topics such as the economy and climate change.  The G8 discusses and creates global policies.  However, adherence to these policies is not obligatory, and other countries can decide whether or not to obey.;;;;;;;;x
supersonic_generic;초음속 상용제트기 계획 완료;Supersonic Commercial Jet Program Completed;;;;;;;;x
supersonic_usa;미국 초음속 상용제트기 계획 완료;US Supersonic Commercial Jet Program Completed;;;;;;;;x
supersonic_rus;러시아 초음속 상용제트기 계획 완료;Russian Supersonic Commercial Jet Program Completed;;;;;;;;x
supersonic_generic_development;초음속 상용제트기 계획 진쟁 중;Supersonic Commercial Jet Program Underway;;;;;;;;x
supersonic_usa_development;미국 초음속 상용제트기 계획 진쟁 중;US Supersonic Commercial Jet Program Underway;;;;;;;;x
supersonic_rus_development;러시아 초음속 상용제트기 계획 진쟁 중;Russian Supersonic Commercial Jet Program Underway;;;;;;;;x
EVTDESC1410134;미국 항공기 회사들은 콩코드 발표 전부터 초음속 여객기, 즉 초음속 여객선의 실현 가능성을 진지하게 보았습니다. 그 중 더글러스 항공사는 1961년에 음속의 3배 속도로 비행할 수 있는 항공기 개념을 만들었습니다. 더글러스사는 1970년까지 그러한 항공기가 날 수 있게 될 뿐만 아니라 수백 대의 항공기 시장이 생길 것이라고 믿었습니다. 알고 보니 콩코드만이 미국인들의 관심을 집중시킬 유일한 이유가 아니었습니다. 철의 장막 반대편에서 러시아도 초음속 수송기와 여객기 'Tu-144'를 만들고 있었습니다. 영국과 프랑스에게 초음속 여객기라는 경기장에서 두들겨 맞는 것은 러시아인들에게 깨끗한 신발 한 켤레를 보여주는 것과 또 다른 문제입니다.;Even before Concorde was announced, American aircraft companies were seriously looking at the feasibility of a supersonic passenger plane, or a Supersonic Transport (SST). One company, Douglas Aircraft, produced a concept in 1961 for an airliner that could fly at three times the speed of sound (Mach 3). Douglas not only believed that such an aircraft could be flying by 1970, but that there would be a market for hundreds of aircraft. Concorde, it turned out, was not the only reason to focus American attention. On the other side of the Iron Curtain, the Russian design bureau Tupolev was also creating a supersonic transport and airliner, the Tu-144. To be beaten in the supersonic airliner arena by the British and the French was one thing ?to be shown a clean pair of heels by the Russians was another.;;;;;;;;x
EVTDESC1410135;Tu-144S는 승객 서비스에 대비해 1975년 12월 26일에 운행을 시작했습니다. 첫 번째 Tu-144D가 1978년 5월 23일 2명의 승무원과 함께 착륙하는 동안 승객 서비스는 기내 결함을 경험할 때까지 준예약 서비스를 운영했습니다. Tu-144의 55번째이자 마지막 여객기는 1978년 6월 1일에 비행을 시작했습니다. 1979년 6월 23일부터 화물 전용 서비스는 보다 효율적인 터보제트 엔진을 사용하는 새로운 생산 변형 Tu-144D 항공기를 사용하기 시작했으며, 최대 순항 속도는 마하 2.15까지 증가했습니다. 55편의 여객기를 포함하면, 상업 운항이 중단되기 전까지 102편의 예약 항공편이 있었습니다.;The Tu-144S went into service on 26 December 1975, flying mail and freight between Moscow and Alma-Ata in preparation for passenger services, which commenced on 1 November 1977. The passenger service ran a semi-scheduled service until the first Tu-144D experienced an in-flight failure during a pre-delivery test flight, crash-landing on 23 May 1978 with two crew fatalities. The Tu-144's 55th and last scheduled passenger flight occurred on 1 June 1978. An Aeroflot freight-only service recommenced using the new production variant Tu-144D aircraft on 23 June 1979, including longer routes from Moscow to Khabarovsk made possible by the more efficient Kolesov RD-36-51 turbojet engines, which also increased the maximum cruising speed to Mach 2.15. Including the 55 passenger flights, there were 102 scheduled flights before the cessation of commercial service.;;;;;;;;x
EVTDESC1410136;초음속 여객기는 음속보다 빠른 속도로 승객을 수송하도록 설계된 민간 초음속 항공기입니다. 초음속 여객기는 수많은 최근 및 진행 중인 설계 연구의 대상입니다. 현재 단점 및 설계시 과제는 이륙과 비행중의 음속으로 인한 과도한 소음 발생, 높은 개발비, 비싼 건설자재, 무거운 중량, 그리고 아음속 여객기에 비해 비싼 좌석비입니다.;A supersonic transport (SST) is a civilian supersonic aircraft designed to transport passengers at speeds greater than the speed of sound. Supersonic airliners have been the objects of numerous recent and ongoing design studies. Drawbacks and design challenges are excessive noise generation (at takeoff and due to sonic booms during flight), high development costs, expensive construction materials, great weight, and an increased cost per seat over subsonic airliners.;;;;;;;;x
supersonic_generic_title;음속 상용제트기 계획 착수;Initiate a Supersonic Commercial Jet Program;;;;;;;;x
supersonic_generic_desc;초음속 여객기는 음속보다 빠른 속도로 승객을 수송하도록 설계된 민간 초음속 항공기입니다. 초음속 여객기는 수많은 최근 및 진행 중인 설계 연구의 대상입니다. 현재 단점 및 설계시 과제는 이륙과 비행중의 음속으로 인한 과도한 소음 발생, 높은 개발비, 비싼 건설자재, 무거운 중량, 그리고 아음속 여객기에 비해 비싼 좌석비입니다.;A supersonic transport (SST) is a civilian supersonic aircraft designed to transport passengers at speeds greater than the speed of sound. Supersonic airliners have been the objects of numerous recent and ongoing design studies. Drawbacks and design challenges are excessive noise generation (at takeoff and due to sonic booms during flight), high development costs, expensive construction materials, great weight, and an increased cost per seat over subsonic airliners.;;;;;;;;x
supersonic_rus_title;음속 상용제트기 계획 착수;Initiate a Supersonic Commercial Jet Program;;;;;;;;x
supersonic_usa_title;음속 상용제트기 계획 착수;Initiate a Supersonic Commercial Jet Program;;;;;;;;x
supersonic_rus_desc;초음속 여객기는 음속보다 빠른 속도로 승객을 수송하도록 설계된 민간 초음속 항공기입니다. 초음속 여객기는 수많은 최근 및 진행 중인 설계 연구의 대상입니다. 현재 단점 및 설계시 과제는 이륙과 비행중의 음속으로 인한 과도한 소음 발생, 높은 개발비, 비싼 건설자재, 무거운 중량, 그리고 아음속 여객기에 비해 비싼 좌석비입니다.;A supersonic transport (SST) is a civilian supersonic aircraft designed to transport passengers at speeds greater than the speed of sound. Supersonic airliners have been the objects of numerous recent and ongoing design studies. Drawbacks and design challenges are excessive noise generation (at takeoff and due to sonic booms during flight), high development costs, expensive construction materials, great weight, and an increased cost per seat over subsonic airliners.;;;;;;;;x
supersonic_usa_desc;초음속 여객기는 음속보다 빠른 속도로 승객을 수송하도록 설계된 민간 초음속 항공기입니다. 초음속 여객기는 수많은 최근 및 진행 중인 설계 연구의 대상입니다. 현재 단점 및 설계시 과제는 이륙과 비행중의 음속으로 인한 과도한 소음 발생, 높은 개발비, 비싼 건설자재, 무거운 중량, 그리고 아음속 여객기에 비해 비싼 좌석비입니다.;A supersonic transport (SST) is a civilian supersonic aircraft designed to transport passengers at speeds greater than the speed of sound. Supersonic airliners have been the objects of numerous recent and ongoing design studies. Drawbacks and design challenges are excessive noise generation (at takeoff and due to sonic booms during flight), high development costs, expensive construction materials, great weight, and an increased cost per seat over subsonic airliners.;;;;;;;;x
changecentral_desc;중앙집중도는 정책을 통과시키고 대중의 지지를 이끌어내는 능력에 영향을 미칩니다. 지방정부가 각 지역의 특정한 요구에 더 잘 부응할 수 있다는 이유로 지방분권화를 추구할 수도 있으나, 빠른 발전을 추구하는 국가는 경제적 안정을 도모할 더 많은 전면적인 변화와 통일성이 필요하므로 중앙집중화를 선호합니다.;The level of Centralisation in our Nation can affect our ability to pass through policies and attract the support of the populace. A cosmopolitan nation may want to have a decentralised government as the local governments would be better at serving to each locale's particular needs. However if a nation is seeking to develop fast, a centralised government would be preferred as it would allow for more sweeping changes and uniformity in the nation that can promote economic stability.;;;;;;;;x
centralmedium_desc;중앙집중형 정부는 행정부가 권력과 법의 강권을 사실상 행사하거나 조정하며 연방주, 지방 당국 및 소규모 지역단위는 행정부의 권한 아래에 있는 정부입니다. 국가적인 맥락에서 중앙집중화는 전형적인 주권국으로의 권력 이양에서 일어납니다. 현재까지는 고대 이집트 초기의 파라오인 메네스가 제1왕조의 시조로서 중앙집중형 정부를 수립한 최초의 통치자입니다.;A centralised government is one in which power or legal authority is exerted or coordinated by a de facto political executive to which federal states, local authorities, and smaller units are considered subject. In a national context, centralisation occurs in the transfer of power to a typically sovereign nation state. Menes, an ancient Egyptian pharaoh of the early dynastic period, is credited by classical tradition with having united Upper and Lower Egypt, and as the founder of the first dynasty (Dynasty I), became the first ruler to institute a centralised government.;;;;;;;;x
centralhigh_desc;대규모 중앙집중화 또는 민주집중제는 (민주적으로 선출된 기관을 통해) 당의 정치적 결정이 모든 구성원들에게 구속력을 갖는 방법입니다. 이는 중앙정부에 모든 지방정부에 대한 완전한 상위 권한을 제공합니다.;Immense Centralisation or Democratic centralism is a method of leadership in which political decisions reached by the party (through its democratically elected bodies) are binding upon all members of the party. This will offer the Central Government complete authority over all local Government branches.;;;;;;;;x
centrallow_desc;정치적 분권은 시민이나 그들이 선출한 대표들에게 더 많은 권한을 줍니다. 그것은 다원적인 정치와 대표 정부와 연관이 있지만, 시민들 또는 그들의 대표자들이 법과 정책의 공식과 실행에 더 많은 영향력을 행사함을 의미하기도 합니다. 국가에 따라서 헌법 또는 법령상의 개혁, 새로운 정당의 발전, 입법부의 권한 증대, 지역 정치 단위의 창설, 그리고 지지 단체의 장려를 필요로 하기도 합니다.;Political decentralisation aims to give citizens or their elected representatives more power. It may be associated with pluralistic politics and representative government, but it also means giving citizens, or their representatives, more influence in the formulation and implementation of laws and policies. Depending on the country, this may require constitutional or statutory reforms, the development of new political parties, increased power for legislatures, the creation of local political units, and encouragement of advocacy groups.;;;;;;;;x
changecentral_title;중앙집중도 변경;Change Level of Governmental Centralisation in State;;;;;;;;x
centralhigh_title;극심한 중앙집중화;Intense Centralisation of State Government;;;;;;;;x
centralmedium_title;중앙집중화;Centralisation of State Government;;;;;;;;x
centrallow_title;지방분권화;De-centralisation of State Government;;;;;;;;x
centralhigh;고중앙집중국;Highly Centralised State;;;;;;;;x
centralmedium;중앙집중국;Centralised State;;;;;;;;x
centrallow;지방분권국;De-centralised State;;;;;;;;x
changecentral;최근 중앙집중도 변경;Recently Changed Level of Centralisation in the Country;;;;;;;;x
EVTDESC1410133;영국과 프랑스가 세계 최초로 초음속 상업용 제트기를 개발하는데 성공했습니다. 콩코드는 두 나라에 관심이 있고 우호적인 모든 국가들에게 판매될 것입니다. 구매하겠습니까? 확실히 인지도를 올리는데 도움을 줄 것입니다.;Britain and France have managed to develop the world's first supersonic commercial jet aircraft. The Concorde will be avaliable for sale to all nations interested and friendly to the two nations. Would we like to purchase one? It will certainly increase our nation's profile.;;;;;;;;x
concorde_development;초음속 제트기 계획 진행 중;Supersonic Jet Program underway;;;;;;;;x
concorde;콩고드 초음속 제트기 개발;Concorde Supersonic Jet developed;;;;;;;;x
EVTDESC1410133;대브리튼과 북아일랜드 연합왕국과 프랑스 공화국이 정부/민간 초음속 여객기를 공동으로 개발/생산하기로 결정하면서 다음과 같이 합의했습니다. 이 협력의 원칙은 계획 전체, 작업, 두 정부의 지출 수입 및 판매 수익에 대한 동등한 책임에 근거해 두 나라가 동등하게 공유합니다. 가능하면 엄격하게 준수해야 하는 이 원칙은 전체(공기, 엔진, 시스템 및 장비)로 간주되는 계획에는 개발 및 생산(예비 포함)과 관련해 적용되어야 합니다. 분담은 양국 정부 간 합의에 의해 명시되는 세금을 제외하고, 각국에서 실시하는 작업에 해당하는 지출에 근거해야 합니다. 이러한 지출은 현재 계약의 데이터에서 계산합니다. 1962년 10월 25일 서드 항공과 영국 항공기 회사의 협정 및 1961년 11월 28일 브리스톨 시들리 협정에 주목한 두 이사회는 그들을 승인했습니다.;The Government of the United Kingdom of Great Britain and Northern Ireland and the Government of the French Republic. Having decided to develop and produce jointly a civil supersonic transport aircraft have agreed as follows: The principle of this collaboration shall be equal sharing between the two countries, on the basis of equal responsibility for the project as a whole, of the work, of the expenditure income by the two Governments, and of the proceeds of sales. This principle, which shall be observed as strictly possible, shall apply, as regards both development and production (including spares), to the project considered as a whole (airframe, engine, system and equipment). The sharing shall be based upon the expenditure corresponding to the work carried out in each country, excluding taxes to be specified by agreement between the two Governments. Such expenditure shall be calculated from the data of the present agreements. The two Goverments having taken note of the agreement dated 25 october l 962 between Sud Aviation and the British Aircraft Corporation (BAC) and of the agrcement dated 28 November 1961, between Bristol Siddeley and the Societe Nationale d'Etude et de Construction de Moteurs d'Aviation (SNECMA) have approved them with provisions, which are the subject of agreement between Governments.;;;;;;;;x
