CODE;ENGLISH;FRENCH;GERMAN;POLISH;SPANISH;HUNGARIAN;CZECH;HUNGARIAN;DUTCH;PORTUGUESE;RUSSIAN;FINNISH;;x;;;;;;;;;;;;;;;;
changenvequality_desc;평등주의는 모든 사람들에게 평등을 선호하는 사고의 추세입니다. 스탠포드 철학 백과사전에 따르면, 평등주의적 교리는 모든 인간이 근본적인 가치나 사회적 지위에서 평등하다고 주장합니다. 메리암 웹스터 사전에 따르면, 해당 용어는 현대 영어에서 두 가지 뚜렷한 정의를 가지는데, 이는 모든 사람들이 평등하게 대우받아야 하며 정치/경제/사회/시민적 권리를 가져야 한다는 정치적 교리이거나, 사람들 사이의 경제적 불평등 해소를 옹호해야 한다고 주장하는 사회철학입니다. 일각에서는 평등주의를 인간의 자연 상태를 반영하는 관점이라고 정의합니다.;Egalitarianism is a trend of thought that favors equality for all people. Egalitarian doctrines maintain that all humans are equal in fundamental worth or social status, according to the Stanford Encyclopedia of Philosophy. According to the Merriam-Webster Dictionary, the term has two distinct definitions in modern English: either as a political doctrine that all people should be treated as equals and have the same political, economic, social, and civil rights or as a social philosophy advocating the removal of economic inequalities among people, economic egalitarianism, or the decentralization of power. Some sources define egalitarianism as the point of view that equality reflects the natural state of humanity.;;;;;;;;x
changenvmeritocracy_desc;실력주의 정치는 권력을 거의 오로지 능력과 재능을 바탕으로 부여해야 한다는 정치적 철학입니다. 이러한 체제의 발전은 시험 또는 현장에서 성과를 입증하면서 정립됐습니다.;Meritocracy is a political philosophy holding that power should be vested in individuals almost exclusively based on ability and talent. Advancement in such a system is based on performance measured through examination and/or demonstrated achievement in the field where it is implemented.;;;;;;;;x
changespy_title;첩보정책 변경;Change Espionage Policy;;;;;;;;x
changespy_desc;필요에 맞는 첩보정책으로 바꿔야 합니다. 첩보는 정보소유자의 허가 없이 비밀/기밀로 간주되는 정보를 빼내는 행위입니다. 주로 정부나 회사가 개인이나 첩보조직을 통해 조직적으로 운영합니다. 이는 첩보라는 관행이 본질적으로 비밀스러워 정의상 대부분 불법이며 법에 저촉하기 때문입니다.;Perhaps we should change our Espionage Policy to better suit our current needs? Espionage is the obtaining of information considered secret or confidential without the permission of the holder of the information. Espionage can be committed by an individual or a spy ring (a cooperating group of spies), in the service of a government or a company, or operating independently. The practice is inherently clandestine, as it is by definition unwelcome and in many cases illegal and punishable by law. Espionage is a subset of "intelligence" gathering, which includes espionage as well as information gathering from public sources.;;;;;;;;x
spy_high;해외연구 탈취;Steal foreign research as State espionage policy;;;;;;;;x
spy_medium;현체제 지원;Prop up current regime as State espionage policy;;;;;;;;x
spy_low;대테러 작전;Counter-Terrorism as State espionage policy;;;;;;;;x
spy_high_gp;전영역 우세;Full Specturm Dominance as State espionage policy;;;;;;;;x
spy_medium_gp;외교적 음모;Diplomatic intrigue as State espionage policy;;;;;;;;x
spy_low_gp;기밀 거래;Intelligence trading as State espionage policy;;;;;;;;x
spy_high_title;해외연구 탈취 선택;Select steal foreign research as State espionage policy;;;;;;;;x
spy_medium_title;현체제 지원 선택;Select prop up current regime as State espionage policy;;;;;;;;x
spy_low_title;대테러작전 선택;Select Counter-Terrorism as State espionage policy;;;;;;;;x
spy_high_gp_title;전영역 우세 선택;Select Full Specturm Dominance as State espionage policy;;;;;;;;x
spy_medium_gp_title;외교적 음모 선택;Select diplomatic intrigue as State espionage policy;;;;;;;;x
spy_low_gp_title;기밀 거래 선택;Select intelligence trading as State espionage policy;;;;;;;;x
spy_high_desc;해외연구 탈취를 국가첩보정책으로 선택합니다.;Select steal foreign research as State espionage policy;;;;;;;;x
spy_medium_desc;현체제 지원을 국가첩보정책으로 선택합니다.;Select prop up current regime as State espionage policy;;;;;;;;x
spy_low_desc;대테러작전을 국가첩보정책으로 선택합니다.;Select Counter-Terrorism as State espionage policy;;;;;;;;x
spy_high_gp_desc;전영역 우세를 국가첩보정책으로 선택합니다.;Select Full Specturm Dominance as State espionage policy;;;;;;;;x
spy_medium_gp_desc;외교적 음모를 국가첩보정책으로 선택합니다.;Select diplomatic intrigue as State espionage policy;;;;;;;;x
spy_low_gp_desc;기밀 거래를 국가첩보정책으로 선택합니다.;Select intelligence trading as State espionage policy;;;;;;;;x
EVTDESC1900000;오늘 상대 초강대국의 국가원수가 엄청난 환호와 군중들을 맞이하며 $COUNTRY$에 도착했습니다. 양국 정상은 $CAPITAL$에서 따뜻한 교류를 나누며 양국 관계를 크게 개선했습니다.;Today the leader of our great superpower rival has arrived in $COUNTRY$ to immense cheers and jubilant mass crowd. Our leaders enjoyed warm exchanges with each other in $CAPITAL$, greatly improving the relations between our 2 great nations.;;;;;;;;x
EVTDESC1800000;몇 시간 전, 긴장이 팽팽한 서독-동독 국경에서 사건이 발생했습니다. 이는 상대 초강대국이 전쟁을 예상하고 국경을 따라 군대를 동원하게끔 했습니다. 우리 장군들도 군사력의 미묘한 균형을 견제하기 위해 같은 일을 수행했습니다. 문제가 심화한다면 전쟁으로 이어질 수도 있습니다. $RULER$, 어떻게 대응해야 할까요?;A few hours ago, there was an incident on the tense West German-East German border. This has triggered a response from the other Superpower who has now decided to mobilise troops along the border in anticipation of a possible war. Our generals have done the same as well to keep the delicate balance of military power in check. A further escalation might lead to war. How should we respond, $RULER$?;;;;;;;;x
EVTDESC1800001;초강대국끼리의 분쟁에 불씨를 지필 수 있는 국가에서 초강대국끼리의 경쟁이 치열해지고 있습니다.;There has been growing Superpower contention in a country that has the potential to spark of a Superpower conflict.;;;;;;;;x
EVTDESC2000000;외교부 장관이 긴장된 냉전 상황을 고려해 긴장을 완화하려면 미국과 소련의 차이를 조율하는 국제정상회담을 개최해야 한다고 제안했습니다. $RULER$, 제안을 받아들여야 할까요?;In light of the tense Cold War situation, our foreign minister has proposed that we host an international summit to iron out the differences between the USA and the USSR to cool down the tensions. Should we accept his suggestion, $RULER$?;;;;;;;;x
EVTDESC2000001;외교부 장관이 긴장된 냉전 상황을 고려해 긴장을 완화하려면 미국과 소련의 차이를 조율하는 국제정상회담에 참가해야 한다고 제안했습니다. $RULER$, 제안을 받아들여야 할까요?;In light of the tense Cold War situation, $FROMCOUNTRY$'s foreign minister has proposed that we participate in an international summit to iron out the differences between the USA and the USSR to cool down the tensions. Should we accept his suggestion, $RULER$?;;;;;;;;x
cold_war_high;냉전 긴장도 높음;Highly tense Cold War Environment;;;;;;;;x
cold_war_medium;냉전 긴장도 중간;Moderately Tense Cold War Environment;;;;;;;;x
cold_war_low;냉전 긴장도 낮음;Detente Cold War Environment;;;;;;;;x
un_king1;제1초강대국;1st Superpower;;;;;;;;x
un_king2;제2초강대국;2nd Superpower;;;;;;;;x
un_king1_title;이익 확보를 위한 제1초강대국과의 제휴;Align with the 1st Superpower to secure our interests;;;;;;;;x
un_king2_title;이익 확보를 위한 제2초강대국과의 제휴;Align with the 2nd Superpower to secure our interests;;;;;;;;x
un_king1_desc;양극성은 두 국가가 국제적/지역적으로 경제적, 군사적, 문화적 영향력의 대부분을 차지하는 힘의 양상입니다. 이는 영향권 싸움으로 전개되는데, 예를 들어 냉전시대에는 대부분의 서구 및 자본주의 국가들은 미국의 영향권에 들 것이며 대부분의 공산주의 국가들은 소련의 영향권에 들 것입니다. 그 후, 두 초강대국은 당시의 아프리카, 호주 등의 영향력 공백지를 차지하려 기동할 것입니다.;Bipolarity is a distribution of power in which two states have the majority of economic, military, and cultural influence internationally or regionally. Often, spheres of influence would develop. For example, in the Cold War, most Western and capitalist states would fall under the influence of the USA, while most Communist states would fall under the influence of the USSR. After this, the two powers will normally maneuver for the support of the unclaimed areas. Which in the case of the Cold War means Africa, Australia, etc.;;;;;;;;x
un_king2_desc;양극성은 두 국가가 국제적/지역적으로 경제적, 군사적, 문화적 영향력의 대부분을 차지하는 힘의 양상입니다. 이는 영향권 싸움으로 전개되는데, 예를 들어 냉전시대에는 대부분의 서구 및 자본주의 국가들은 미국의 영향권에 들 것이며 대부분의 공산주의 국가들은 소련의 영향권에 들 것입니다. 그 후, 두 초강대국은 당시의 아프리카, 호주 등의 영향력 공백지를 차지하려 기동할 것입니다.;Bipolarity is a distribution of power in which two states have the majority of economic, military, and cultural influence internationally or regionally. Often, spheres of influence would develop. For example, in the Cold War, most Western and capitalist states would fall under the influence of the USA, while most Communist states would fall under the influence of the USSR. After this, the two powers will normally maneuver for the support of the unclaimed areas. Which in the case of the Cold War means Africa, Australia, etc.;;;;;;;;x
king_timer;최근 초강대국과 제휴;Recently aligned with a Superpower;;;;;;;;x
king_timer_desc;초강대국과의 유대를 강화하는 또다른 외교적 지원에 대비하려면 시간이 필요합니다.;Time is needed to prepare for another diiplomatic push to strengthen ties with a Superpower.;;;;;;;;x
superpower;초강대국 지위;Superpower Status;;;;;;;;x
superpower_desc;세계 2위권 안에 드므로 강대국과는 상당한 외교적 역량 차이를 가진 초강대국으로 간주됩니다.;Since we are rank among the top 2 nations in the world, we have been considered to be a Superpower which gives us considerable diplomatic capabilities that are out of reach of mere Great Powers.;;;;;;;;x
seikan_tunnel_construction;세이칸 터널 공사 중;Seikan Tunnel construction underway;;;;;;;;x
seikan_tunnel;세이칸 터널;Seikan Tunnel;;;;;;;;x
seikan_tunnel_title;세이칸 터널 건설;Build the Seikan Tunnel;;;;;;;;x
seikan_tunnel_desc;세이칸 터널은 일본의 53.85km 길이의 철도터널로, 해저 구간은 23.3km입니다. 선로의 높이는 해저가 약 100m이고 해수면 아래가 약 240m입니다. 세이칸이라는 이름은 해협에서 가장 가까운 주요 도시인 아오모리와 홋카이도 쪽에서 가장 가까운 주요 도시인 하코다테의 첫음절을 합힌 후 일본 한자음대로 읽은 것입니다. 세이칸 터널은 세계에서 가장 긴 해저 터널이나, 해저 구간으로 한정하면 영불해협 터널이 더 깁니다. 2016년 개통된 스위스 고타드기지터널에 이어 두 번째로 깊고 긴 간선철도터널이기도 합니다.;The Seikan Tunnel (Japanese: Seikan Tonneru or Japanese: Seikan Zuido) is a 53.85 km (33.46 mi) dual gauge railway tunnel in Japan, with a 23.3 km (14.5 mi) long portion under the seabed. The track level is about 100 metres (330 ft) below the seabed and 240 m (790 ft) below sea level. It extends beneath the Tsugaru Strait뾠onnecting Aomori Prefecture on the main Japanese island of Honshu with the northern island of Hokkaido뾞s part of the standard gauge Hokkaido Shinkansen and the narrow gauge Kaikyo Line portion of the Hokkaido Railway Company (JR Hokkaido)'s Tsugaru-Kaikyo Line. The name Seikan comes from combining the on'yomi readings of the first characters of Aomori, the nearest major city on the Honshu side of the strait, and Hakodate, the nearest major city on the Hokkaido side. The Seikan Tunnel is the world's longest undersea tunnel, although the Channel tunnel has a longer undersea section. It is also the second deepest and the second longest main-line railway tunnel after the Gotthard Base Tunnel in Switzerland opened on 2016.;;;;;;;;x
demohigh_gp;자유진영 중점: 무장 높음, 경제 낮음;High militarisation and low economic focus for the Democratic Bloc;;;;;;;;x
demomedium_gp;자유진영 중점: 무장 중간, 경제 중간;Medium militarisation and medium economic focus for the Democratic Bloc;;;;;;;;x
demolow_gp;자유진영 중점: 무장 낮음, 경제 높음;Low militarisation and High economic focus for the Democratic Bloc;;;;;;;;x
demohigh;자유진영 중점: 무장 높음, 경제 낮음;High militarisation and low economic focus for the Democratic Bloc;;;;;;;;x
demomedium;자유진영 중점: 무장 중간, 경제 중간;Medium militarisation and medium economic focus for the Democratic Bloc;;;;;;;;x
demolow;자유진영 중점: 무장 낮음, 경제 높음;Low militarisation and High economic focus for the Democratic Bloc;;;;;;;;x
demohigh_title;자유진영 중점: 무장 높음, 경제 낮음;High militarisation and low economic focus for the Democratic Bloc;;;;;;;;x
demomedium_title;자유진영 중점: 무장 중간, 경제 중간;Medium militarisation and medium economic focus for the Democratic Bloc;;;;;;;;x
demolow_title;자유진영 중점: 무장 낮음, 경제 높음;Low militarisation and High economic focus for the Democratic Bloc;;;;;;;;x
demohigh_desc;자유진영 중점을 무장 높음, 경제 낮음으로 설정합니다.;High militarisation and low economic focus for the Democratic Bloc;;;;;;;;x
demomedium_desc;자유진영 중점을 무장 중간, 경제 중간으로 설정합니다.;Medium militarisation and medium economic focus for the Democratic Bloc;;;;;;;;x
demolow_desc;자유진영 중점을 무장 낮음, 경제 높음으로 설정합니다.;Low militarisation and High economic focus for the Democratic Bloc;;;;;;;;x
changedemobloc_desc;냉전시대 당시 서구권 또는 자유진영은 소련과 그 동맹국에 대항해 미국 및 북대서양 조약기구와 연합한 국가들을 말합니다. 영어권에서는 서구권보다는 민주진영을 더 많이 사용했으며, 서구권의 정부와 언론은 스스로를 자유진영 또는 서구세계라고 부르는 경향이 더 강했습니다.;The Western Bloc or Democratic Bloc during the Cold War refers to the countries allied with the United States and NATO against the Soviet Union and its allies. The latter were referred to as the Eastern Bloc, a more common term in English than Western Bloc. The governments and press of the Western Bloc were more inclined to refer to themselves as the Free World or the Western world.;;;;;;;;x
changedemobloc_title;자유진영 중점 변경;Change focus for the Democratic Bloc;;;;;;;;x
oecd_member;경제협력개발기구 회원국;Member of the Organisation for Economic Co-operation and Development;;;;;;;;x
jointheoecd_title;경제협력개발기구 가입;Join the Organisation for Economic Co-operation and Development;;;;;;;;x
jointheoecd_desc;경제협력개발기구는 1960년 경제 발전과 세계 무역을 촉진하려는 목적을 가진 정부간 경제기구로, 35개국이 가입했습니다. 주로 민주주의와 시장경제에 대한 헌신을 기술하고, 정책경험을 비교하고, 공통적인 문제에 대한 해답을 찾고, 좋은 관행을 확인하고, 회원들국의 국내외 정책을 조율합니다. 회원국 대부분이 인간개발지수가 매우 높은 고소득국가이며 선진국이기도 합니다.;The Organisation for Economic Co-operation and Development (OECD) is an intergovernmental economic organisation with 35 member countries, founded in 1960 to stimulate economic progress and world trade. It is a forum of countries describing themselves as committed to democracy and the market economy, providing a platform to compare policy experiences, seeking answers to common problems, identify good practices and coordinate domestic and international policies of its members. Most OECD members are high-income economies with a very high Human Development Index (HDI) and are regarded as developed countries.;;;;;;;;x
leavetheoecd_desc;경제협력개발기구는 1960년 경제 발전과 세계 무역을 촉진하려는 목적을 가진 정부간 경제기구로, 35개국이 가입했습니다. 주로 민주주의와 시장경제에 대한 헌신을 기술하고, 정책경험을 비교하고, 공통적인 문제에 대한 해답을 찾고, 좋은 관행을 확인하고, 회원들국의 국내외 정책을 조율합니다. 회원국 대부분이 인간개발지수가 매우 높은 고소득국가이며 선진국이기도 합니다.;The Organisation for Economic Co-operation and Development (OECD) is an intergovernmental economic organisation with 35 member countries, founded in 1960 to stimulate economic progress and world trade. It is a forum of countries describing themselves as committed to democracy and the market economy, providing a platform to compare policy experiences, seeking answers to common problems, identify good practices and coordinate domestic and international policies of its members. Most OECD members are high-income economies with a very high Human Development Index (HDI) and are regarded as developed countries.;;;;;;;;x
formtheoecd_desc;경제협력개발기구는 1960년 경제 발전과 세계 무역을 촉진하려는 목적을 가진 정부간 경제기구로, 35개국이 가입했습니다. 주로 민주주의와 시장경제에 대한 헌신을 기술하고, 정책경험을 비교하고, 공통적인 문제에 대한 해답을 찾고, 좋은 관행을 확인하고, 회원들국의 국내외 정책을 조율합니다. 회원국 대부분이 인간개발지수가 매우 높은 고소득국가이며 선진국이기도 합니다.;The Organisation for Economic Co-operation and Development (OECD) is an intergovernmental economic organisation with 35 member countries, founded in 1960 to stimulate economic progress and world trade. It is a forum of countries describing themselves as committed to democracy and the market economy, providing a platform to compare policy experiences, seeking answers to common problems, identify good practices and coordinate domestic and international policies of its members. Most OECD members are high-income economies with a very high Human Development Index (HDI) and are regarded as developed countries.;;;;;;;;x
leavetheoecd_title;경제협력개발기구 탈퇴;Leave the Organisation for Economic Co-operation and Development;;;;;;;;x
formtheoecd_title;경제협력개발기구 결성;Form the Organisation for Economic Co-operation and Development;;;;;;;;x
keiretsu;기업계열;Keiretsu Corporate Structure;;;;;;;;x
keiretsu_desc;게이레쓰, 우리말로 계열은 상호연계적인 사업 관계와 지분을 가진 회사들의 집합체로, 비공식적인 재벌의 한 종류입니다. 이들은 20세기 후반 동안 일본 경제를 지배했습니다. 회원사는 핵심 은행을 중심으로 한 서로의 주식을 적게나마 소유합니다. 이는 서로의 주식시장의 변동과 인수 시도를 차단하는 데 도움이 됩니다. 따라서 혁신적인 계획을 장기적으로 세울 수 있습니다.;A keiretsu, literally system, series, grouping of enterprises, order of succession) is a set of companies with interlocking business relationships and shareholdings. It is a type of informal business group. The keiretsu maintained dominance over the Japanese economy for the second half of the 20th century.The member companies own small portions of the shares in each other's companies, centered on a core bank; this system helps insulate each company from stock market fluctuations and takeover attempts, thus enabling long-term planning in innovative projects.;;;;;;;;x
soviet_stability;소비에트 안정;Soviet Stability;;;;;;;;x
changefrancophone_title;프랑스어권 중점 변경;Change La Francophonie Focus;;;;;;;;x
changefrancophone_desc;프랑스어권의 문화적 패권국이라는 지위를 이용해 무역, 민주주의, 사회주의, 비간섭주의를 육성하는 의제를 추진할 수 있습니다.;As we are the cultural hegemon of the La Francophonie, we can use that position to push our agenda in the La Francophonie to promote trade, promote democracy, promote socialism or to promote non-inteventionism.;;;;;;;;x
francophoneoption1_title;프랑스어권 긴밀한 무역 육성;Promote closer trade ties in La Francophonie;;;;;;;;x
francophoneoption1_desc;프랑스어권 국가들 간에 긴밀한 무역관계를 육성해 더 많은 자유무역협정을 맺음으로서 우리 기업들이 힘을 얻습니다.;Promote closer trade ties in La Francophonie will give our companies a boost by allowing us to foster more free trade deals with other La Francophonie nations.;;;;;;;;x
francophoneoption2_title;프랑스어권 민주주의 육성;Promote democracy in La Francophonie;;;;;;;;x
francophoneoption2_desc;프랑스어권 국가들 간에 민주주의를 육성해 더 개방적이고 책임감 있는 정부를 가지도록 돕습니다.;Promote democracy in La Francophonie will increase the demand for democracy in La Francophonie which will help encourage members to have more open and accountable governments.;;;;;;;;x
francophoneoption3_title;프랑스어권 인권 및 복지 육성;Promote human rights & welfare in La Francophonie;;;;;;;;x
francophoneoption3_desc;프랑스어권 국가들 간에 인권과 복지를 육성해 회원국들이 진정으로 시민들을 돌보는 더 인도적인 정부를 갖도록 돕습니다.;Promote human rights & welfare in La Francophonie will help the La Francophonie member states to have a more humane governments that truly care for their citizens.;;;;;;;;x
francophoneoption4_title;프랑스어권 비간섭주의 육성;Promote non-interventionism in La Francophonie;;;;;;;;x
francophoneoption4_desc;프랑스어권 국가들 간에 비간섭주의를 육성해 국제주의의 격동의 역풍으로부터 회원국들을 보호하고 회원국들을 내정간섭으로부터 보호합니다.;Promote non-interventionism in La Francophonie to help protect members from the tumultous headwinds of internationalism and protect members from unwanted La Francophonie interference in internal affairs.;;;;;;;;x
franc_area;프랑통화동맹 회원국;Member of the Franc Currency Union;;;;;;;;x
post_colonial_chaos;독립 이후의 혼란;Post Independence Chaos;;;;;;;;x
revolution_chaos;혁명 시작;Revolutionary Stirrings;;;;;;;;x
francophoneoption1;프랑스어권 무역 중점;La Francophonie Trade Focus;;;;;;;;x
francophoneoption2;프랑스어권 민주주의 중점;La Francophonie Democracy Focus;;;;;;;;x
francophoneoption3;프랑스어권 사회주의 중점;La Francophonie Socialism Focus;;;;;;;;x
francophoneoption4;프랑스어권 비간섭주의 중점;La Francophonie Non-Interventionism Focus;;;;;;;;x
joinfrancophone_title;프랑스어권 가입;Join the La Francophonie;;;;;;;;x
